{
  "$schema": "../../../mission.schema.json",
  "schemaVersion": 1,
  "key": "work-meetings-b1-bring-back-topic",
  "title": "벗어난 회의 주제를 되돌리기",
  "categoryId": "work",
  "subcategoryId": "meetings",
  "difficulty": "B1",
  "scenario": "배송 지연 해결 회의가 사무실 가구 이야기로 흘렀습니다. 남은 시간은 10분입니다.",
  "practicalOutcome": "다른 주제 인정하기 / 현재 목적 상기시키기 / 구체적 질문으로 복귀하기",
  "roles": {
    "learner": "가상 팀 회의의 참여자 또는 진행자",
    "interlocutor": "동료. 관련 없는 주제를 꺼내지만 일정과 목적을 상기시키면 원래 논의로 돌아온다."
  },
  "opening": "We should also replace the office chairs.",
  "estimatedMinutes": 12,
  "prerequisites": [],
  "steps": [
    {
      "id": "step-1",
      "goal": "다른 주제 인정하기",
      "example": "That's worth discussing in another meeting.",
      "hints": [
        "의도: 다른 주제 인정하기",
        "핵심 표현: worth = 할 가치가 있는",
        "완성 문장 예시: That's worth discussing in another meeting. — 의미가 같은 다른 표현도 가능합니다."
      ],
      "successCriterion": "상대가 이해할 수 있게 다음 행동을 수행한다: 다른 주제 인정하기. 예문과 단어가 같아야 하는 것은 아니다."
    },
    {
      "id": "step-2",
      "goal": "현재 목적 상기시키기",
      "example": "We still need a decision on the delivery issue.",
      "hints": [
        "의도: 현재 목적 상기시키기",
        "핵심 표현: decision = 결정",
        "완성 문장 예시: We still need a decision on the delivery issue. — 의미가 같은 다른 표현도 가능합니다."
      ],
      "successCriterion": "상대가 이해할 수 있게 다음 행동을 수행한다: 현재 목적 상기시키기. 예문과 단어가 같아야 하는 것은 아니다."
    },
    {
      "id": "step-3",
      "goal": "구체적 질문으로 복귀하기",
      "example": "Can we agree who will contact the supplier today?",
      "hints": [
        "의도: 구체적 질문으로 복귀하기",
        "핵심 표현: supplier = 공급업체",
        "완성 문장 예시: Can we agree who will contact the supplier today? — 의미가 같은 다른 표현도 가능합니다."
      ],
      "successCriterion": "상대가 이해할 수 있게 다음 행동을 수행한다: 구체적 질문으로 복귀하기. 예문과 단어가 같아야 하는 것은 아니다."
    }
  ],
  "pedagogy": {
    "researchIds": [
      "CEFR-2020",
      "TBLT-2019",
      "TBLT-CRITIQUE",
      "SPACING-2022",
      "RETRIEVAL-2008",
      "FEEDBACK-2010",
      "FOUR-STRANDS-2007"
    ],
    "supportFade": "이유·경험 연결; 요청 시 핵심 표현 제공. 먼저 상황과 첫 발화의 뜻을 확인하고 다른 주제 인정하기에 필요한 표현을 살핀다. 의도→핵심 표현→완성 문장 순으로 필요한 도움만 제공한다. 두 번째 시도는 완성 문장을 가리고, 세 번째는 힌트를 가린다. 막히면 도움을 다시 제공하고 도움받은 수행과 독립 수행을 구분한다.",
    "retrieval": "예문을 가린 뒤 '벗어난 회의 주제를 되돌리기' 상황에서 다른 주제 인정하기 / 현재 목적 상기시키기 / 구체적 질문으로 복귀하기 기억한 문장을 그대로 외우기보다 상대의 질문에 맞춰 자신의 말로 응답한다.",
    "transfer": "다음에는 벗어난 주제가 실제 관련 위험이라 짧게 기록한 뒤 우선순위를 다시 정한다.",
    "review": {
      "intervalDays": [
        1,
        3,
        7,
        21
      ],
      "prompt": "복습 간격은 초기 운영 가설이며 성공과 어려움에 따라 조정한다. '벗어난 회의 주제를 되돌리기'을 무힌트로 다시 수행한다. 이어서 조건을 바꾼다: 다음에는 벗어난 주제가 실제 관련 위험이라 짧게 기록한 뒤 우선순위를 다시 정한다. 결과와 도움 사용을 따로 기록한다."
    }
  },
  "assessment": {
    "criteria": [
      "다른 주제 인정하기 / 현재 목적 상기시키기 / 구체적 질문으로 복귀하기",
      "다른 주제 인정하기",
      "현재 목적 상기시키기",
      "구체적 질문으로 복귀하기",
      "수준별 관찰: 예상 밖 문제 설명과 복구. 문법 오류 수나 희귀 단어만으로 판정하지 않는다."
    ],
    "acceptParaphrases": true,
    "feedbackPolicy": "먼저 전달된 의미와 달성한 과업을 짚는다. 의미 전달을 막는 오류 한두 개에 짧은 한국어 설명과 재표현 기회를 제공한다. 초보가 막히면 예시를 보여준 뒤 다시 시도하게 한다. 도움받은 완료를 독립 숙달로 판정하지 않고 조건 변경 및 지연 수행을 별도로 확인한다. 텍스트만으로 발음·청취 성공을 판정하지 않는다."
  }
}
