{
  "$schema": "../../../mission.schema.json",
  "schemaVersion": 1,
  "key": "social-feelings-opinions-c2-revise-conviction-publicly",
  "title": "공개적으로 강한 의견을 수정하기",
  "categoryId": "social",
  "subcategoryId": "feelings-opinions",
  "difficulty": "C2",
  "scenario": "모임에서 자신 있게 주장한 수치가 잘못됐다는 자료를 확인했습니다. 전체 입장을 유지할 부분도 있습니다. 연습 자료: 당신은 한 달 행사 이용자가 200명이라고 했으나 중복을 뺀 기록은 80명입니다. 별도의 접근성 점검에서는 계단만 있는 입구 때문에 참여하지 못한 사례 6건이 확인됐습니다. 기존 제안은 큰 행사 공간 확대였고, 작은 접근성 개선 시범사업은 대안입니다.",
  "practicalOutcome": "오류를 숨기지 않고 근거별 영향에 따라 주장을 재구성한다.",
  "roles": {
    "learner": "상황 속 대화 참여자(가상 정보 사용)",
    "interlocutor": "토론 상대. 수치 오류를 인정하면 제안 전체가 무효라고 생각한다."
  },
  "opening": "So your whole argument falls apart, doesn't it?",
  "estimatedMinutes": 20,
  "prerequisites": [],
  "steps": [
    {
      "id": "step-1",
      "goal": "오류를 명확히 인정하기",
      "example": "I said two hundred participants, but the corrected count is eighty. I should withdraw the original figure without qualification.",
      "hints": [
        "의도: 오류를 명확히 인정하기",
        "핵심 표현: corrected count = 수정된 집계; without qualification = 단서 없이",
        "완성 문장 예시: I said two hundred participants, but the corrected count is eighty. I should withdraw the original figure without qualification. — 의미가 같은 다른 표현도 가능합니다."
      ],
      "successCriterion": "상대가 이해할 수 있게 다음 행동을 수행한다: 오류를 명확히 인정하기. 예문과 단어가 같아야 하는 것은 아니다."
    },
    {
      "id": "step-2",
      "goal": "영향 범위 재평가하기",
      "example": "That weakens the case for a larger venue, though the six documented access problems still need attention.",
      "hints": [
        "의도: 영향 범위 재평가하기",
        "핵심 표현: weakens the case = 주장의 근거를 약화한다; documented = 기록으로 확인된",
        "완성 문장 예시: That weakens the case for a larger venue, though the six documented access problems still need attention. — 의미가 같은 다른 표현도 가능합니다."
      ],
      "successCriterion": "상대가 이해할 수 있게 다음 행동을 수행한다: 영향 범위 재평가하기. 예문과 단어가 같아야 하는 것은 아니다."
    },
    {
      "id": "step-3",
      "goal": "수정된 입장 제시하기",
      "example": "I would now propose a smaller access-improvement pilot, with the remaining uncertainties stated openly.",
      "hints": [
        "의도: 수정된 입장 제시하기",
        "핵심 표현: access-improvement pilot = 접근성 개선 시범사업; uncertainties = 불확실한 점",
        "완성 문장 예시: I would now propose a smaller access-improvement pilot, with the remaining uncertainties stated openly. — 의미가 같은 다른 표현도 가능합니다."
      ],
      "successCriterion": "상대가 이해할 수 있게 다음 행동을 수행한다: 수정된 입장 제시하기. 예문과 단어가 같아야 하는 것은 아니다."
    }
  ],
  "pedagogy": {
    "researchIds": [
      "CEFR-2020",
      "TBLT-2019",
      "TBLT-CRITIQUE",
      "SPACING-2022",
      "RETRIEVAL-2008",
      "FEEDBACK-2010",
      "FOUR-STRANDS-2007"
    ],
    "supportFade": "독립 수행 우선; 희귀 어휘 대신 정밀성과 청중 적합성 관찰. 먼저 상황과 첫 발화의 뜻을 확인하고 오류를 명확히 인정하기에 필요한 표현을 살핀다. 의도→핵심 표현→완성 문장 순으로 필요한 도움만 제공한다. 두 번째 시도는 완성 문장을 가리고, 세 번째는 힌트를 가린다. 막히면 도움을 다시 제공하고 도움받은 수행과 독립 수행을 구분한다.",
    "retrieval": "예문을 가린 뒤 '공개적으로 강한 의견을 수정하기' 상황에서 오류를 숨기지 않고 근거별 영향에 따라 주장을 재구성한다. 기억한 문장을 그대로 외우기보다 상대의 질문에 맞춰 자신의 말로 응답한다.",
    "transfer": "다른 근거도 검증되지 않았음이 드러난다. 결론을 유지하려 억지로 방어하지 말고 보류한다.",
    "review": {
      "intervalDays": [
        1,
        3,
        7,
        21
      ],
      "prompt": "복습 간격은 초기 운영 가설이며 성공과 어려움에 따라 조정한다. '공개적으로 강한 의견을 수정하기'을 무힌트로 다시 수행한다. 이어서 조건을 바꾼다: 다른 근거도 검증되지 않았음이 드러난다. 결론을 유지하려 억지로 방어하지 말고 보류한다. 결과와 도움 사용을 따로 기록한다."
    }
  },
  "assessment": {
    "criteria": [
      "오류를 숨기지 않고 근거별 영향에 따라 주장을 재구성한다.",
      "오류를 명확히 인정하기",
      "영향 범위 재평가하기",
      "수정된 입장 제시하기",
      "수준별 관찰: 미묘한 의미와 상충 조건을 정교하게 재구성. 문법 오류 수나 희귀 단어만으로 판정하지 않는다."
    ],
    "acceptParaphrases": true,
    "feedbackPolicy": "먼저 전달된 의미와 달성한 과업을 짚는다. 의미 전달을 막는 오류 한두 개에 짧은 한국어 설명과 재표현 기회를 제공한다. 초보가 막히면 예시를 보여준 뒤 다시 시도하게 한다. 도움받은 완료를 독립 숙달로 판정하지 않고 조건 변경 및 지연 수행을 별도로 확인한다. 텍스트만으로 발음·청취 성공을 판정하지 않는다."
  }
}
