{
  "$schema": "../../../mission.schema.json",
  "schemaVersion": 1,
  "key": "social-friends-family-c2-untangle-family-loyalty",
  "title": "가족에 대한 충성과 비밀 유지 요구 구분하기",
  "categoryId": "social",
  "subcategoryId": "friends-family",
  "difficulty": "C2",
  "scenario": "가족 갈등을 누구에게도 말하지 않는 것이 충성이라는 요구를 받습니다. 개인적인 지원을 구할 권리는 유지하려 합니다.",
  "practicalOutcome": "관계 존중을 유지하면서 외부 지원을 전면 금지하는 요구에 경계를 정한다.",
  "roles": {
    "learner": "상황 속 대화 참여자(가상 정보 사용)",
    "interlocutor": "가족 역할. 외부에 알려지는 것이 두렵고 공개 망신과 비공개 상담을 혼동한다."
  },
  "opening": "If you're loyal to the family, you won't discuss this with anyone.",
  "estimatedMinutes": 20,
  "prerequisites": [],
  "steps": [
    {
      "id": "step-1",
      "goal": "충성의 양자택일 전제 검토하기",
      "example": "Supporting the family and seeking confidential support are not necessarily opposing choices.",
      "hints": [
        "의도: 충성의 양자택일 전제 검토하기",
        "핵심 표현: confidential support = 비공개 지원",
        "완성 문장 예시: Supporting the family and seeking confidential support are not necessarily opposing choices. — 의미가 같은 다른 표현도 가능합니다."
      ],
      "successCriterion": "상대가 이해할 수 있게 다음 행동을 수행한다: 충성의 양자택일 전제 검토하기. 예문과 단어가 같아야 하는 것은 아니다."
    },
    {
      "id": "step-2",
      "goal": "공개와 비공개 도움 구분하기",
      "example": "I'm not proposing to publicise private details; I need a space to think with someone outside the conflict.",
      "hints": [
        "의도: 공개와 비공개 도움 구분하기",
        "핵심 표현: publicise = 공개하다",
        "완성 문장 예시: I'm not proposing to publicise private details; I need a space to think with someone outside the conflict. — 의미가 같은 다른 표현도 가능합니다."
      ],
      "successCriterion": "상대가 이해할 수 있게 다음 행동을 수행한다: 공개와 비공개 도움 구분하기. 예문과 단어가 같아야 하는 것은 아니다."
    },
    {
      "id": "step-3",
      "goal": "자신의 경계 명확히 하기",
      "example": "I'll be careful about what I share, but I can't promise complete isolation from support.",
      "hints": [
        "의도: 자신의 경계 명확히 하기",
        "핵심 표현: isolation = 고립",
        "완성 문장 예시: I'll be careful about what I share, but I can't promise complete isolation from support. — 의미가 같은 다른 표현도 가능합니다."
      ],
      "successCriterion": "상대가 이해할 수 있게 다음 행동을 수행한다: 자신의 경계 명확히 하기. 예문과 단어가 같아야 하는 것은 아니다."
    }
  ],
  "pedagogy": {
    "researchIds": [
      "CEFR-2020",
      "TBLT-2019",
      "TBLT-CRITIQUE",
      "SPACING-2022",
      "RETRIEVAL-2008",
      "FEEDBACK-2010",
      "FOUR-STRANDS-2007"
    ],
    "supportFade": "독립 수행 우선; 희귀 어휘 대신 정밀성과 청중 적합성 관찰. 먼저 상황과 첫 발화의 뜻을 확인하고 충성의 양자택일 전제 검토하기에 필요한 표현을 살핀다. 의도→핵심 표현→완성 문장 순으로 필요한 도움만 제공한다. 두 번째 시도는 완성 문장을 가리고, 세 번째는 힌트를 가린다. 막히면 도움을 다시 제공하고 도움받은 수행과 독립 수행을 구분한다.",
    "retrieval": "예문을 가린 뒤 '가족에 대한 충성과 비밀 유지 요구 구분하기' 상황에서 관계 존중을 유지하면서 외부 지원을 전면 금지하는 요구에 경계를 정한다. 기억한 문장을 그대로 외우기보다 상대의 질문에 맞춰 자신의 말로 응답한다.",
    "transfer": "상대가 익명으로 상황을 설명하는 방안을 제안한다. 필요한 정보와 보호할 정보를 구분한다.",
    "review": {
      "intervalDays": [
        1,
        3,
        7,
        21
      ],
      "prompt": "복습 간격은 초기 운영 가설이며 성공과 어려움에 따라 조정한다. '가족에 대한 충성과 비밀 유지 요구 구분하기'을 무힌트로 다시 수행한다. 이어서 조건을 바꾼다: 상대가 익명으로 상황을 설명하는 방안을 제안한다. 필요한 정보와 보호할 정보를 구분한다. 결과와 도움 사용을 따로 기록한다."
    }
  },
  "assessment": {
    "criteria": [
      "관계 존중을 유지하면서 외부 지원을 전면 금지하는 요구에 경계를 정한다.",
      "충성의 양자택일 전제 검토하기",
      "공개와 비공개 도움 구분하기",
      "자신의 경계 명확히 하기",
      "수준별 관찰: 미묘한 의미와 상충 조건을 정교하게 재구성. 문법 오류 수나 희귀 단어만으로 판정하지 않는다."
    ],
    "acceptParaphrases": true,
    "feedbackPolicy": "먼저 전달된 의미와 달성한 과업을 짚는다. 의미 전달을 막는 오류 한두 개에 짧은 한국어 설명과 재표현 기회를 제공한다. 초보가 막히면 예시를 보여준 뒤 다시 시도하게 한다. 도움받은 완료를 독립 숙달로 판정하지 않고 조건 변경 및 지연 수행을 별도로 확인한다. 텍스트만으로 발음·청취 성공을 판정하지 않는다."
  }
}
