{
  "$schema": "../../../mission.schema.json",
  "schemaVersion": 1,
  "key": "daily-food-drink-pre-a1-point-menu",
  "title": "메뉴를 가리켜 고르기",
  "categoryId": "daily",
  "subcategoryId": "food-drink",
  "difficulty": "pre-A1",
  "scenario": "글로 표시된 가상 메뉴는 1번 sandwich(샌드위치), 2번 soup(수프)입니다. 1번 하나를 원합니다. 실제 사진 없이 [가리키기: 1번 샌드위치]라는 한국어 동작 표시와 짧은 영어를 함께 입력할 수 있습니다.",
  "practicalOutcome": "모르는 메뉴 이름을 대신해 가리키기 표현으로 주문한다.",
  "roles": {
    "learner": "식당·카페 손님",
    "interlocutor": "직원. 가상 메뉴 1번 샌드위치, 2번 수프를 알고 있다. 학습자의 한국어 가리키기 표시는 역할극 속 동작으로 이해하고 영어로 메뉴와 수량을 한 번에 하나씩 확인한다."
  },
  "opening": "This one?",
  "estimatedMinutes": 5,
  "prerequisites": [],
  "steps": [
    {
      "id": "step-1",
      "goal": "원하는 메뉴를 가리키기",
      "example": "This, please.",
      "hints": [
        "의도: 원하는 메뉴를 가리키기",
        "핵심 표현: this = 이것",
        "완성 문장 예시: This, please. — 의미가 같은 다른 표현도 가능합니다."
      ],
      "successCriterion": "상대가 이해할 수 있게 다음 행동을 수행한다: 원하는 메뉴를 가리키기. 예문과 단어가 같아야 하는 것은 아니다."
    },
    {
      "id": "step-2",
      "goal": "한 개라고 답하기",
      "example": "One.",
      "hints": [
        "의도: 한 개라고 답하기",
        "핵심 표현: one = 하나",
        "완성 문장 예시: One. — 의미가 같은 다른 표현도 가능합니다."
      ],
      "successCriterion": "상대가 이해할 수 있게 다음 행동을 수행한다: 한 개라고 답하기. 예문과 단어가 같아야 하는 것은 아니다."
    },
    {
      "id": "step-3",
      "goal": "주문 확인에 동의하기",
      "example": "Yes, thank you.",
      "hints": [
        "의도: 주문 확인에 동의하기",
        "핵심 표현: yes = 네",
        "완성 문장 예시: Yes, thank you. — 의미가 같은 다른 표현도 가능합니다."
      ],
      "successCriterion": "상대가 이해할 수 있게 다음 행동을 수행한다: 주문 확인에 동의하기. 예문과 단어가 같아야 하는 것은 아니다."
    }
  ],
  "pedagogy": {
    "researchIds": [
      "CEFR-2020",
      "TBLT-2019",
      "TBLT-CRITIQUE",
      "SPACING-2022",
      "RETRIEVAL-2008",
      "FEEDBACK-2010",
      "FOUR-STRANDS-2007"
    ],
    "supportFade": "한국어 뜻, 짧은 모델, 단어 선택을 제공; 단어 하나도 의미가 맞으면 인정. 먼저 상황과 첫 발화의 뜻을 확인하고 원하는 메뉴를 가리키기에 필요한 표현을 살핀다. 의도→핵심 표현→완성 문장 순으로 필요한 도움만 제공한다. 두 번째 시도는 완성 문장을 가리고, 세 번째는 힌트를 가린다. 막히면 도움을 다시 제공하고 도움받은 수행과 독립 수행을 구분한다.",
    "retrieval": "예문을 가린 뒤 '메뉴를 가리켜 고르기' 상황에서 모르는 메뉴 이름을 대신해 가리키기 표현으로 주문한다. 기억한 문장을 그대로 외우기보다 상대의 질문에 맞춰 자신의 말로 응답한다.",
    "transfer": "다음에는 2번 soup(수프)를 고른다. 직원이 1번을 잘못 확인하면 [가리키기: 2번 수프] No. This.라고 정정한다. 실제 사진은 필요 없다.",
    "review": {
      "intervalDays": [
        1,
        3,
        7,
        21
      ],
      "prompt": "복습 간격은 초기 운영 가설이며 성공과 어려움에 따라 조정한다. '메뉴를 가리켜 고르기'을 무힌트로 다시 수행한다. 이어서 조건을 바꾼다: 다음에는 2번 soup(수프)를 고른다. 직원이 1번을 잘못 확인하면 [가리키기: 2번 수프] No. This.라고 정정한다. 실제 사진은 필요 없다. 결과와 도움 사용을 따로 기록한다."
    }
  },
  "assessment": {
    "criteria": [
      "모르는 메뉴 이름을 대신해 가리키기 표현으로 주문한다.",
      "원하는 메뉴를 가리키기",
      "한 개라고 답하기",
      "주문 확인에 동의하기",
      "수준별 관찰: 단어와 정형 표현으로 의도 전달. 문법 오류 수나 희귀 단어만으로 판정하지 않는다."
    ],
    "acceptParaphrases": true,
    "feedbackPolicy": "먼저 전달된 의미와 달성한 과업을 짚는다. 의미 전달을 막는 오류 한두 개에 짧은 한국어 설명과 재표현 기회를 제공한다. 초보가 막히면 예시를 보여준 뒤 다시 시도하게 한다. 도움받은 완료를 독립 숙달로 판정하지 않고 조건 변경 및 지연 수행을 별도로 확인한다. 텍스트만으로 발음·청취 성공을 판정하지 않는다."
  }
}
