{
  "$schema": "../../../mission.schema.json",
  "schemaVersion": 1,
  "key": "work-meetings-c1-business-conditional-budget",
  "title": "조건부 예산 승인을 실행 허가로 오해하지 않기",
  "categoryId": "work",
  "subcategoryId": "meetings",
  "difficulty": "C1",
  "scenario": "책임자가 비교 견적을 확인하면 예산이 가능하다고 했는데 팀은 지금 주문해도 된다고 이해합니다.",
  "practicalOutcome": "조건부 예산 상태와 구매 승인 전 해야 할 일을 정한다.",
  "roles": {
    "learner": "구매 프로젝트 담당자. 조건과 상태를 설명하며 승인권은 책임자에게 있다.",
    "interlocutor": "팀 리드. 예산 범위 안이라면 먼저 주문해도 된다고 생각하지만 조건이 남았다는 설명을 들을 수 있다."
  },
  "caseBrief": {
    "professionalRole": "cross-functional",
    "situation": "책임자가 비교 견적을 확인하면 예산이 가능하다고 했는데 팀은 지금 주문해도 된다고 이해합니다.",
    "facts": [
      "예산 한도는 5만 파운드다.",
      "비교 견적 두 개 중 하나만 도착했다.",
      "책임자는 두 견적 검토 후 승인하기로 했다.",
      "담당자는 내일 오후 3시에 두 번째 견적의 도착 상태를 확인한다."
    ],
    "constraints": [
      "예산 확보 가능성과 구매 승인을 구분한다.",
      "두 번째 견적은 내일 도착 예정이다."
    ],
    "learnerAuthority": "구매 프로젝트 담당자. 조건과 상태를 설명하며 승인권은 책임자에게 있다.",
    "counterpartPosition": "팀 리드. 예산 범위 안이라면 먼저 주문해도 된다고 생각하지만 조건이 남았다는 설명을 들을 수 있다.",
    "unresolvedQuestions": [
      "남은 승인 조건은 무엇인가?",
      "견적 지연 시 누가 대체 절차를 결정하는가?"
    ],
    "deliverable": "조건부 예산 상태와 구매 승인 전 해야 할 일을 정한다.",
    "resolutionCriteria": [
      "한도와 승인을 분리한다.",
      "남은 조건을 명시한다.",
      "담당자와 지연 시 대안을 정한다."
    ],
    "escalationPath": "두 번째 견적이 늦으면 책임자에게 단일 견적 검토 허용 여부를 요청하며 임의로 조건을 없애지 않는다."
  },
  "opening": "The budget was agreed, so why are we still waiting to order?",
  "estimatedMinutes": 18,
  "prerequisites": [],
  "steps": [
    {
      "id": "step-1",
      "goal": "동의의 정확한 범위 설명하기",
      "example": "The owner indicated that funding could be available within fifty thousand pounds, subject to reviewing both quotations; the purchasing approval is still outstanding.",
      "hints": [
        "의도: 동의의 정확한 범위 설명하기",
        "핵심 표현: subject to = 조건으로",
        "완성 문장 예시: The owner indicated that funding could be available within fifty thousand pounds, subject to reviewing both quotations; the purchasing approval is still outstanding. — 의미가 같은 다른 표현도 가능합니다."
      ],
      "successCriterion": "상대가 이해할 수 있게 다음 행동을 수행한다: 동의의 정확한 범위 설명하기. 예문과 단어가 같아야 하는 것은 아니다."
    },
    {
      "id": "step-2",
      "goal": "남은 조건 특정하기",
      "example": "We have one quotation, and the second is due tomorrow. That is the condition we have not met yet.",
      "hints": [
        "의도: 남은 조건 특정하기",
        "핵심 표현: quotation = 견적",
        "완성 문장 예시: We have one quotation, and the second is due tomorrow. That is the condition we have not met yet. — 의미가 같은 다른 표현도 가능합니다."
      ],
      "successCriterion": "상대가 이해할 수 있게 다음 행동을 수행한다: 남은 조건 특정하기. 예문과 단어가 같아야 하는 것은 아니다."
    },
    {
      "id": "step-3",
      "goal": "진행 가능한 준비 제안하기",
      "example": "We can complete the comparison framework now without placing an order or implying approval to the supplier.",
      "hints": [
        "의도: 진행 가능한 준비 제안하기",
        "핵심 표현: implying approval = 승인된 듯 말하는 것",
        "완성 문장 예시: We can complete the comparison framework now without placing an order or implying approval to the supplier. — 의미가 같은 다른 표현도 가능합니다."
      ],
      "successCriterion": "상대가 이해할 수 있게 다음 행동을 수행한다: 진행 가능한 준비 제안하기. 예문과 단어가 같아야 하는 것은 아니다."
    },
    {
      "id": "step-4",
      "goal": "지연 시 판단 경로 정하기",
      "example": "I will check the quote status at three tomorrow. If it has not arrived, I will ask the owner whether an exception is acceptable rather than waive the condition ourselves.",
      "hints": [
        "의도: 지연 시 판단 경로 정하기",
        "핵심 표현: waive = 면제하다",
        "완성 문장 예시: I will check the quote status at three tomorrow. If it has not arrived, I will ask the owner whether an exception is acceptable rather than waive the condition ourselves. — 의미가 같은 다른 표현도 가능합니다."
      ],
      "successCriterion": "상대가 이해할 수 있게 다음 행동을 수행한다: 지연 시 판단 경로 정하기. 예문과 단어가 같아야 하는 것은 아니다."
    }
  ],
  "pedagogy": {
    "researchIds": [
      "CEFR-2020",
      "TBLT-2019",
      "TBLT-CRITIQUE",
      "SPACING-2022",
      "RETRIEVAL-2008",
      "FEEDBACK-2010",
      "FOUR-STRANDS-2007"
    ],
    "supportFade": "요청 시만 지원; 전제와 불확실성 구분. 먼저 상황과 첫 발화의 뜻을 확인하고 동의의 정확한 범위 설명하기에 필요한 표현을 살핀다. 의도→핵심 표현→완성 문장 순으로 필요한 도움만 제공한다. 두 번째 시도는 완성 문장을 가리고, 세 번째는 힌트를 가린다. 막히면 도움을 다시 제공하고 도움받은 수행과 독립 수행을 구분한다.",
    "retrieval": "예문을 가린 뒤 '조건부 예산 승인을 실행 허가로 오해하지 않기' 상황에서 조건부 예산 상태와 구매 승인 전 해야 할 일을 정한다. 기억한 문장을 그대로 외우기보다 상대의 질문에 맞춰 자신의 말로 응답한다.",
    "transfer": "두 견적은 왔지만 사양이 다르다. 개수 충족과 비교 가능한 근거 확보를 구분한다.",
    "review": {
      "intervalDays": [
        1,
        3,
        7,
        21
      ],
      "prompt": "복습 간격은 초기 운영 가설이며 성공과 어려움에 따라 조정한다. '조건부 예산 승인을 실행 허가로 오해하지 않기'을 무힌트로 다시 수행한다. 이어서 조건을 바꾼다: 두 견적은 왔지만 사양이 다르다. 개수 충족과 비교 가능한 근거 확보를 구분한다. 결과와 도움 사용을 따로 기록한다."
    }
  },
  "assessment": {
    "criteria": [
      "조건부 예산 상태와 구매 승인 전 해야 할 일을 정한다.",
      "동의의 정확한 범위 설명하기",
      "남은 조건 특정하기",
      "진행 가능한 준비 제안하기",
      "지연 시 판단 경로 정하기",
      "한도와 승인을 분리한다.",
      "남은 조건을 명시한다.",
      "담당자와 지연 시 대안을 정한다.",
      "수준별 관찰: 어조 조절, 암시 이해, 복합 정보 중재. 문법 오류 수나 희귀 단어만으로 판정하지 않는다."
    ],
    "acceptParaphrases": true,
    "feedbackPolicy": "먼저 전달된 의미와 달성한 과업을 짚는다. 의미 전달을 막는 오류 한두 개에 짧은 한국어 설명과 재표현 기회를 제공한다. 초보가 막히면 예시를 보여준 뒤 다시 시도하게 한다. 도움받은 완료를 독립 숙달로 판정하지 않고 조건 변경 및 지연 수행을 별도로 확인한다. 텍스트만으로 발음·청취 성공을 판정하지 않는다."
  }
}
