{
  "$schema": "../../../mission.schema.json",
  "schemaVersion": 1,
  "key": "social-introductions-a2-exchange-safe-contact",
  "title": "연락 방법을 골라 교환하기",
  "categoryId": "social",
  "subcategoryId": "introductions",
  "difficulty": "A2",
  "scenario": "만난 사람과 연락을 이어 가고 싶지만 개인 전화번호는 공유하지 않으려 합니다.",
  "practicalOutcome": "원하는 개인정보 범위 안에서 연락 수단을 정한다.",
  "roles": {
    "learner": "상황 속 대화 참여자(가상 정보 사용)",
    "interlocutor": "모임 참가자. 전화번호를 물었다가 이메일도 괜찮다고 답한다."
  },
  "opening": "Can I have your phone number?",
  "estimatedMinutes": 10,
  "prerequisites": [],
  "steps": [
    {
      "id": "step-1",
      "goal": "다른 연락 방법 제안하기",
      "example": "Can we use email instead?",
      "hints": [
        "의도: 다른 연락 방법 제안하기",
        "핵심 표현: instead = 대신",
        "완성 문장 예시: Can we use email instead? — 의미가 같은 다른 표현도 가능합니다."
      ],
      "successCriterion": "상대가 이해할 수 있게 다음 행동을 수행한다: 다른 연락 방법 제안하기. 예문과 단어가 같아야 하는 것은 아니다."
    },
    {
      "id": "step-2",
      "goal": "연습용 주소 전달하기",
      "example": "My email is min@example.com.",
      "hints": [
        "의도: 연습용 주소 전달하기",
        "핵심 표현: email = 이메일",
        "완성 문장 예시: My email is min@example.com. — 의미가 같은 다른 표현도 가능합니다."
      ],
      "successCriterion": "상대가 이해할 수 있게 다음 행동을 수행한다: 연습용 주소 전달하기. 예문과 단어가 같아야 하는 것은 아니다."
    },
    {
      "id": "step-3",
      "goal": "첫 연락 내용 정하기",
      "example": "Please send me the next meeting time.",
      "hints": [
        "의도: 첫 연락 내용 정하기",
        "핵심 표현: next meeting = 다음 모임",
        "완성 문장 예시: Please send me the next meeting time. — 의미가 같은 다른 표현도 가능합니다."
      ],
      "successCriterion": "상대가 이해할 수 있게 다음 행동을 수행한다: 첫 연락 내용 정하기. 예문과 단어가 같아야 하는 것은 아니다."
    }
  ],
  "pedagogy": {
    "researchIds": [
      "CEFR-2020",
      "TBLT-2019",
      "TBLT-CRITIQUE",
      "SPACING-2022",
      "RETRIEVAL-2008",
      "FEEDBACK-2010",
      "FOUR-STRANDS-2007"
    ],
    "supportFade": "표현 틀을 선택적으로 제공; 세부 정보와 다음 행동 확인. 먼저 상황과 첫 발화의 뜻을 확인하고 다른 연락 방법 제안하기에 필요한 표현을 살핀다. 의도→핵심 표현→완성 문장 순으로 필요한 도움만 제공한다. 두 번째 시도는 완성 문장을 가리고, 세 번째는 힌트를 가린다. 막히면 도움을 다시 제공하고 도움받은 수행과 독립 수행을 구분한다.",
    "retrieval": "예문을 가린 뒤 '연락 방법을 골라 교환하기' 상황에서 원하는 개인정보 범위 안에서 연락 수단을 정한다. 기억한 문장을 그대로 외우기보다 상대의 질문에 맞춰 자신의 말로 응답한다.",
    "transfer": "이메일 대신 모임의 공개 그룹 채팅을 이용한다. 가입 링크를 요청한다.",
    "review": {
      "intervalDays": [
        1,
        3,
        7,
        21
      ],
      "prompt": "복습 간격은 초기 운영 가설이며 성공과 어려움에 따라 조정한다. '연락 방법을 골라 교환하기'을 무힌트로 다시 수행한다. 이어서 조건을 바꾼다: 이메일 대신 모임의 공개 그룹 채팅을 이용한다. 가입 링크를 요청한다. 결과와 도움 사용을 따로 기록한다."
    }
  },
  "assessment": {
    "criteria": [
      "원하는 개인정보 범위 안에서 연락 수단을 정한다.",
      "다른 연락 방법 제안하기",
      "연습용 주소 전달하기",
      "첫 연락 내용 정하기",
      "수준별 관찰: 일상 거래와 간단한 문제 해결. 문법 오류 수나 희귀 단어만으로 판정하지 않는다."
    ],
    "acceptParaphrases": true,
    "feedbackPolicy": "먼저 전달된 의미와 달성한 과업을 짚는다. 의미 전달을 막는 오류 한두 개에 짧은 한국어 설명과 재표현 기회를 제공한다. 초보가 막히면 예시를 보여준 뒤 다시 시도하게 한다. 도움받은 완료를 독립 숙달로 판정하지 않고 조건 변경 및 지연 수행을 별도로 확인한다. 텍스트만으로 발음·청취 성공을 판정하지 않는다."
  }
}
