{
  "$schema": "../../../mission.schema.json",
  "schemaVersion": 1,
  "key": "travel-transport-c2-service-guarantee-language",
  "title": "정시 도착 보장의 예외 조항 명확히 하기",
  "categoryId": "travel",
  "subcategoryId": "transport",
  "difficulty": "C2",
  "scenario": "셔틀 광고는 도착 보장, 상담원은 교통 상황에 따라 다르다고 설명합니다. 비행기를 놓칠 위험이 있습니다.",
  "practicalOutcome": "광고상 보장을 시간 약속과 사후 조치로 구분한다.",
  "roles": {
    "learner": "공항 셔틀 예약자",
    "interlocutor": "상담원. 도착 시각은 예상이며 보장은 셔틀 요금 환급에 한정되고 항공권 비용은 포함하지 않는다."
  },
  "opening": "Arrival is guaranteed, subject to traffic conditions and our standard exclusions.",
  "estimatedMinutes": 20,
  "prerequisites": [],
  "steps": [
    {
      "id": "step-1",
      "goal": "보장의 대상 분리하기",
      "example": "Is the guarantee about arriving by a specified time, or about a remedy if that time is missed?",
      "hints": [
        "의도: 보장의 대상 분리하기",
        "핵심 표현: remedy = 문제 발생 시 조치",
        "완성 문장 예시: Is the guarantee about arriving by a specified time, or about a remedy if that time is missed? — 의미가 같은 다른 표현도 가능합니다."
      ],
      "successCriterion": "상대가 이해할 수 있게 다음 행동을 수행한다: 보장의 대상 분리하기. 예문과 단어가 같아야 하는 것은 아니다."
    },
    {
      "id": "step-2",
      "goal": "일상 의미와 약관 의미 차이 확인하기",
      "example": "Those are materially different promises from a traveller’s perspective; I would like the limitation stated plainly.",
      "hints": [
        "의도: 일상 의미와 약관 의미 차이 확인하기",
        "핵심 표현: limitation = 제한",
        "완성 문장 예시: Those are materially different promises from a traveller’s perspective; I would like the limitation stated plainly. — 의미가 같은 다른 표현도 가능합니다."
      ],
      "successCriterion": "상대가 이해할 수 있게 다음 행동을 수행한다: 일상 의미와 약관 의미 차이 확인하기. 예문과 단어가 같아야 하는 것은 아니다."
    },
    {
      "id": "step-3",
      "goal": "선택에 필요한 실질 정보 요청하기",
      "example": "Please separate the estimated journey time, the recommended buffer, and the exact remedy so I can judge the risk myself.",
      "hints": [
        "의도: 선택에 필요한 실질 정보 요청하기",
        "핵심 표현: buffer = 여유 시간",
        "완성 문장 예시: Please separate the estimated journey time, the recommended buffer, and the exact remedy so I can judge the risk myself. — 의미가 같은 다른 표현도 가능합니다."
      ],
      "successCriterion": "상대가 이해할 수 있게 다음 행동을 수행한다: 선택에 필요한 실질 정보 요청하기. 예문과 단어가 같아야 하는 것은 아니다."
    }
  ],
  "pedagogy": {
    "researchIds": [
      "CEFR-2020",
      "TBLT-2019",
      "TBLT-CRITIQUE",
      "SPACING-2022",
      "RETRIEVAL-2008",
      "FEEDBACK-2010",
      "FOUR-STRANDS-2007"
    ],
    "supportFade": "독립 수행 우선; 희귀 어휘 대신 정밀성과 청중 적합성 관찰. 먼저 상황과 첫 발화의 뜻을 확인하고 보장의 대상 분리하기에 필요한 표현을 살핀다. 의도→핵심 표현→완성 문장 순으로 필요한 도움만 제공한다. 두 번째 시도는 완성 문장을 가리고, 세 번째는 힌트를 가린다. 막히면 도움을 다시 제공하고 도움받은 수행과 독립 수행을 구분한다.",
    "retrieval": "예문을 가린 뒤 '정시 도착 보장의 예외 조항 명확히 하기' 상황에서 광고상 보장을 시간 약속과 사후 조치로 구분한다. 기억한 문장을 그대로 외우기보다 상대의 질문에 맞춰 자신의 말로 응답한다.",
    "transfer": "환급 대신 다음 이용권만 준다. 보상 수단의 실질 가치를 확인한다.",
    "review": {
      "intervalDays": [
        1,
        3,
        7,
        21
      ],
      "prompt": "복습 간격은 초기 운영 가설이며 성공과 어려움에 따라 조정한다. '정시 도착 보장의 예외 조항 명확히 하기'을 무힌트로 다시 수행한다. 이어서 조건을 바꾼다: 환급 대신 다음 이용권만 준다. 보상 수단의 실질 가치를 확인한다. 결과와 도움 사용을 따로 기록한다."
    }
  },
  "assessment": {
    "criteria": [
      "광고상 보장을 시간 약속과 사후 조치로 구분한다.",
      "보장의 대상 분리하기",
      "일상 의미와 약관 의미 차이 확인하기",
      "선택에 필요한 실질 정보 요청하기",
      "수준별 관찰: 미묘한 의미와 상충 조건을 정교하게 재구성. 문법 오류 수나 희귀 단어만으로 판정하지 않는다."
    ],
    "acceptParaphrases": true,
    "feedbackPolicy": "먼저 전달된 의미와 달성한 과업을 짚는다. 의미 전달을 막는 오류 한두 개에 짧은 한국어 설명과 재표현 기회를 제공한다. 초보가 막히면 예시를 보여준 뒤 다시 시도하게 한다. 도움받은 완료를 독립 숙달로 판정하지 않고 조건 변경 및 지연 수행을 별도로 확인한다. 텍스트만으로 발음·청취 성공을 판정하지 않는다."
  }
}
