{
  "$schema": "../../../mission.schema.json",
  "schemaVersion": 1,
  "key": "daily-routines-a2-join-beginner-class",
  "title": "초보 수업인지 확인하고 참여하기",
  "categoryId": "daily",
  "subcategoryId": "routines",
  "difficulty": "A2",
  "scenario": "댄스 수업에 처음 참가합니다. 준비물과 초보 지원을 확인합니다.",
  "practicalOutcome": "자신의 수준과 수업 준비 조건을 확인한다.",
  "roles": {
    "learner": "수업 신규 참가자",
    "interlocutor": "강사. 입문반은 경험 불필요, 편한 신발 필요, 처음 10분 기본 동작 설명이라고 안내한다."
  },
  "opening": "Have you danced before?",
  "estimatedMinutes": 10,
  "prerequisites": [],
  "steps": [
    {
      "id": "step-1",
      "goal": "경험 수준 말하기",
      "example": "No, I am a complete beginner.",
      "hints": [
        "의도: 경험 수준 말하기",
        "핵심 표현: complete beginner = 완전 초보",
        "완성 문장 예시: No, I am a complete beginner. — 의미가 같은 다른 표현도 가능합니다."
      ],
      "successCriterion": "상대가 이해할 수 있게 다음 행동을 수행한다: 경험 수준 말하기. 예문과 단어가 같아야 하는 것은 아니다."
    },
    {
      "id": "step-2",
      "goal": "수업 방식 묻기",
      "example": "Do you explain the basic steps first?",
      "hints": [
        "의도: 수업 방식 묻기",
        "핵심 표현: basic steps = 기본 동작",
        "완성 문장 예시: Do you explain the basic steps first? — 의미가 같은 다른 표현도 가능합니다."
      ],
      "successCriterion": "상대가 이해할 수 있게 다음 행동을 수행한다: 수업 방식 묻기. 예문과 단어가 같아야 하는 것은 아니다."
    },
    {
      "id": "step-3",
      "goal": "준비물 확인하기",
      "example": "Should I bring comfortable shoes and water?",
      "hints": [
        "의도: 준비물 확인하기",
        "핵심 표현: comfortable = 편한",
        "완성 문장 예시: Should I bring comfortable shoes and water? — 의미가 같은 다른 표현도 가능합니다."
      ],
      "successCriterion": "상대가 이해할 수 있게 다음 행동을 수행한다: 준비물 확인하기. 예문과 단어가 같아야 하는 것은 아니다."
    }
  ],
  "pedagogy": {
    "researchIds": [
      "CEFR-2020",
      "TBLT-2019",
      "TBLT-CRITIQUE",
      "SPACING-2022",
      "RETRIEVAL-2008",
      "FEEDBACK-2010",
      "FOUR-STRANDS-2007"
    ],
    "supportFade": "표현 틀을 선택적으로 제공; 세부 정보와 다음 행동 확인. 먼저 상황과 첫 발화의 뜻을 확인하고 경험 수준 말하기에 필요한 표현을 살핀다. 의도→핵심 표현→완성 문장 순으로 필요한 도움만 제공한다. 두 번째 시도는 완성 문장을 가리고, 세 번째는 힌트를 가린다. 막히면 도움을 다시 제공하고 도움받은 수행과 독립 수행을 구분한다.",
    "retrieval": "예문을 가린 뒤 '초보 수업인지 확인하고 참여하기' 상황에서 자신의 수준과 수업 준비 조건을 확인한다. 기억한 문장을 그대로 외우기보다 상대의 질문에 맞춰 자신의 말로 응답한다.",
    "transfer": "기존 수업이 중급으로 바뀌었다. 입문반 일정이나 참관 가능 여부를 묻는다.",
    "review": {
      "intervalDays": [
        1,
        3,
        7,
        21
      ],
      "prompt": "복습 간격은 초기 운영 가설이며 성공과 어려움에 따라 조정한다. '초보 수업인지 확인하고 참여하기'을 무힌트로 다시 수행한다. 이어서 조건을 바꾼다: 기존 수업이 중급으로 바뀌었다. 입문반 일정이나 참관 가능 여부를 묻는다. 결과와 도움 사용을 따로 기록한다."
    }
  },
  "assessment": {
    "criteria": [
      "자신의 수준과 수업 준비 조건을 확인한다.",
      "경험 수준 말하기",
      "수업 방식 묻기",
      "준비물 확인하기",
      "수준별 관찰: 일상 거래와 간단한 문제 해결. 문법 오류 수나 희귀 단어만으로 판정하지 않는다."
    ],
    "acceptParaphrases": true,
    "feedbackPolicy": "먼저 전달된 의미와 달성한 과업을 짚는다. 의미 전달을 막는 오류 한두 개에 짧은 한국어 설명과 재표현 기회를 제공한다. 초보가 막히면 예시를 보여준 뒤 다시 시도하게 한다. 도움받은 완료를 독립 숙달로 판정하지 않고 조건 변경 및 지연 수행을 별도로 확인한다. 텍스트만으로 발음·청취 성공을 판정하지 않는다."
  }
}
