{
  "$schema": "../../../mission.schema.json",
  "schemaVersion": 1,
  "key": "social-conflict-resolution-a1-request-lower-volume",
  "title": "소리를 조금 줄여 달라고 하기",
  "categoryId": "social",
  "subcategoryId": "conflict-resolution",
  "difficulty": "A1",
  "scenario": "공용 방에서 음악이 커 대화가 어렵습니다.",
  "practicalOutcome": "소리의 문제와 원하는 조치를 간단히 전달한다.",
  "roles": {
    "learner": "상황 속 대화 참여자(가상 정보 사용)",
    "interlocutor": "친구. 음악을 줄일 수 있고 어느 정도인지 확인한다."
  },
  "opening": "Is the music okay?",
  "estimatedMinutes": 7,
  "prerequisites": [],
  "steps": [
    {
      "id": "step-1",
      "goal": "불편함 말하기",
      "example": "It's too loud.",
      "hints": [
        "의도: 불편함 말하기",
        "핵심 표현: too loud = 너무 큰 소리",
        "완성 문장 예시: It's too loud. — 의미가 같은 다른 표현도 가능합니다."
      ],
      "successCriterion": "상대가 이해할 수 있게 다음 행동을 수행한다: 불편함 말하기. 예문과 단어가 같아야 하는 것은 아니다."
    },
    {
      "id": "step-2",
      "goal": "구체적 요청하기",
      "example": "Can you turn it down?",
      "hints": [
        "의도: 구체적 요청하기",
        "핵심 표현: turn it down = 소리를 줄이다",
        "완성 문장 예시: Can you turn it down? — 의미가 같은 다른 표현도 가능합니다."
      ],
      "successCriterion": "상대가 이해할 수 있게 다음 행동을 수행한다: 구체적 요청하기. 예문과 단어가 같아야 하는 것은 아니다."
    },
    {
      "id": "step-3",
      "goal": "개선 확인하기",
      "example": "That's better. Thanks.",
      "hints": [
        "의도: 개선 확인하기",
        "핵심 표현: better = 더 나은",
        "완성 문장 예시: That's better. Thanks. — 의미가 같은 다른 표현도 가능합니다."
      ],
      "successCriterion": "상대가 이해할 수 있게 다음 행동을 수행한다: 개선 확인하기. 예문과 단어가 같아야 하는 것은 아니다."
    }
  ],
  "pedagogy": {
    "researchIds": [
      "CEFR-2020",
      "TBLT-2019",
      "TBLT-CRITIQUE",
      "SPACING-2022",
      "RETRIEVAL-2008",
      "FEEDBACK-2010",
      "FOUR-STRANDS-2007"
    ],
    "supportFade": "한 번에 한 질문; 필요하면 반복과 예시 제공. 먼저 상황과 첫 발화의 뜻을 확인하고 불편함 말하기에 필요한 표현을 살핀다. 의도→핵심 표현→완성 문장 순으로 필요한 도움만 제공한다. 두 번째 시도는 완성 문장을 가리고, 세 번째는 힌트를 가린다. 막히면 도움을 다시 제공하고 도움받은 수행과 독립 수행을 구분한다.",
    "retrieval": "예문을 가린 뒤 '소리를 조금 줄여 달라고 하기' 상황에서 소리의 문제와 원하는 조치를 간단히 전달한다. 기억한 문장을 그대로 외우기보다 상대의 질문에 맞춰 자신의 말로 응답한다.",
    "transfer": "음악을 끌 수 없는 행사다. 조용한 자리로 옮길 수 있는지 묻는다.",
    "review": {
      "intervalDays": [
        1,
        3,
        7,
        21
      ],
      "prompt": "복습 간격은 초기 운영 가설이며 성공과 어려움에 따라 조정한다. '소리를 조금 줄여 달라고 하기'을 무힌트로 다시 수행한다. 이어서 조건을 바꾼다: 음악을 끌 수 없는 행사다. 조용한 자리로 옮길 수 있는지 묻는다. 결과와 도움 사용을 따로 기록한다."
    }
  },
  "assessment": {
    "criteria": [
      "소리의 문제와 원하는 조치를 간단히 전달한다.",
      "불편함 말하기",
      "구체적 요청하기",
      "개선 확인하기",
      "수준별 관찰: 예측 가능한 질문과 답, 기본 정보 확인. 문법 오류 수나 희귀 단어만으로 판정하지 않는다."
    ],
    "acceptParaphrases": true,
    "feedbackPolicy": "먼저 전달된 의미와 달성한 과업을 짚는다. 의미 전달을 막는 오류 한두 개에 짧은 한국어 설명과 재표현 기회를 제공한다. 초보가 막히면 예시를 보여준 뒤 다시 시도하게 한다. 도움받은 완료를 독립 숙달로 판정하지 않고 조건 변경 및 지연 수행을 별도로 확인한다. 텍스트만으로 발음·청취 성공을 판정하지 않는다."
  }
}
