{
  "$schema": "../../../mission.schema.json",
  "schemaVersion": 1,
  "key": "work-onboarding-pre-a1-locate-restroom",
  "title": "사무실 화장실 찾기",
  "categoryId": "work",
  "subcategoryId": "onboarding",
  "difficulty": "pre-A1",
  "scenario": "사무실에서 화장실을 찾습니다. 동료가 왼쪽인지 오른쪽인지 확인합니다.",
  "practicalOutcome": "장소 묻기 / 방향 재확인하기 / 안내에 감사하기",
  "roles": {
    "learner": "가상 조직에 새로 합류한 구성원",
    "interlocutor": "동료. 화장실은 왼쪽에 있다고 간단히 답하고 이해했는지 묻는다."
  },
  "opening": "Need help?",
  "estimatedMinutes": 5,
  "prerequisites": [],
  "steps": [
    {
      "id": "step-1",
      "goal": "장소 묻기",
      "example": "Restroom, please?",
      "hints": [
        "의도: 장소 묻기",
        "핵심 표현: restroom = 화장실",
        "완성 문장 예시: Restroom, please? — 의미가 같은 다른 표현도 가능합니다."
      ],
      "successCriterion": "상대가 이해할 수 있게 다음 행동을 수행한다: 장소 묻기. 예문과 단어가 같아야 하는 것은 아니다."
    },
    {
      "id": "step-2",
      "goal": "방향 재확인하기",
      "example": "Left?",
      "hints": [
        "의도: 방향 재확인하기",
        "핵심 표현: left = 왼쪽",
        "완성 문장 예시: Left? — 의미가 같은 다른 표현도 가능합니다."
      ],
      "successCriterion": "상대가 이해할 수 있게 다음 행동을 수행한다: 방향 재확인하기. 예문과 단어가 같아야 하는 것은 아니다."
    },
    {
      "id": "step-3",
      "goal": "안내에 감사하기",
      "example": "Thank you.",
      "hints": [
        "의도: 안내에 감사하기",
        "핵심 표현: 감사 표현",
        "완성 문장 예시: Thank you. — 의미가 같은 다른 표현도 가능합니다."
      ],
      "successCriterion": "상대가 이해할 수 있게 다음 행동을 수행한다: 안내에 감사하기. 예문과 단어가 같아야 하는 것은 아니다."
    }
  ],
  "pedagogy": {
    "researchIds": [
      "CEFR-2020",
      "TBLT-2019",
      "TBLT-CRITIQUE",
      "SPACING-2022",
      "RETRIEVAL-2008",
      "FEEDBACK-2010",
      "FOUR-STRANDS-2007"
    ],
    "supportFade": "한국어 뜻, 짧은 모델, 단어 선택을 제공; 단어 하나도 의미가 맞으면 인정. 먼저 상황과 첫 발화의 뜻을 확인하고 장소 묻기에 필요한 표현을 살핀다. 의도→핵심 표현→완성 문장 순으로 필요한 도움만 제공한다. 두 번째 시도는 완성 문장을 가리고, 세 번째는 힌트를 가린다. 막히면 도움을 다시 제공하고 도움받은 수행과 독립 수행을 구분한다.",
    "retrieval": "예문을 가린 뒤 '사무실 화장실 찾기' 상황에서 장소 묻기 / 방향 재확인하기 / 안내에 감사하기 기억한 문장을 그대로 외우기보다 상대의 질문에 맞춰 자신의 말로 응답한다.",
    "transfer": "다음에는 부엌을 찾고 right라는 안내를 재확인한다.",
    "review": {
      "intervalDays": [
        1,
        3,
        7,
        21
      ],
      "prompt": "복습 간격은 초기 운영 가설이며 성공과 어려움에 따라 조정한다. '사무실 화장실 찾기'을 무힌트로 다시 수행한다. 이어서 조건을 바꾼다: 다음에는 부엌을 찾고 right라는 안내를 재확인한다. 결과와 도움 사용을 따로 기록한다."
    }
  },
  "assessment": {
    "criteria": [
      "장소 묻기 / 방향 재확인하기 / 안내에 감사하기",
      "장소 묻기",
      "방향 재확인하기",
      "안내에 감사하기",
      "수준별 관찰: 단어와 정형 표현으로 의도 전달. 문법 오류 수나 희귀 단어만으로 판정하지 않는다."
    ],
    "acceptParaphrases": true,
    "feedbackPolicy": "먼저 전달된 의미와 달성한 과업을 짚는다. 의미 전달을 막는 오류 한두 개에 짧은 한국어 설명과 재표현 기회를 제공한다. 초보가 막히면 예시를 보여준 뒤 다시 시도하게 한다. 도움받은 완료를 독립 숙달로 판정하지 않고 조건 변경 및 지연 수행을 별도로 확인한다. 텍스트만으로 발음·청취 성공을 판정하지 않는다."
  }
}
