{
  "$schema": "../../../mission.schema.json",
  "schemaVersion": 1,
  "key": "work-collaboration-b2-negotiate-scope",
  "title": "요청 증가에 범위와 기한 조율하기",
  "categoryId": "work",
  "subcategoryId": "collaboration",
  "difficulty": "B2",
  "scenario": "원래 보고서에 새 분석 두 개가 추가됐지만 마감은 같습니다. 핵심 분석 하나만 우선 가능할 듯합니다.",
  "practicalOutcome": "변경 영향 설명하기 / 필수 범위 확인하기 / 단계 납품 제안하기",
  "roles": {
    "learner": "가상 팀에서 공동 업무를 맡은 동료",
    "interlocutor": "요청자. 고객 발표에는 첫 분석만 필요하고 두 번째는 내부 참고라고 답한다."
  },
  "opening": "Can you add these two analyses by tomorrow?",
  "estimatedMinutes": 15,
  "prerequisites": [],
  "steps": [
    {
      "id": "step-1",
      "goal": "변경 영향 설명하기",
      "example": "Adding both would require more time than the current deadline allows.",
      "hints": [
        "의도: 변경 영향 설명하기",
        "핵심 표현: allows = 허용한다",
        "완성 문장 예시: Adding both would require more time than the current deadline allows. — 의미가 같은 다른 표현도 가능합니다."
      ],
      "successCriterion": "상대가 이해할 수 있게 다음 행동을 수행한다: 변경 영향 설명하기. 예문과 단어가 같아야 하는 것은 아니다."
    },
    {
      "id": "step-2",
      "goal": "필수 범위 확인하기",
      "example": "Which analysis is essential for the customer presentation?",
      "hints": [
        "의도: 필수 범위 확인하기",
        "핵심 표현: essential = 필수의",
        "완성 문장 예시: Which analysis is essential for the customer presentation? — 의미가 같은 다른 표현도 가능합니다."
      ],
      "successCriterion": "상대가 이해할 수 있게 다음 행동을 수행한다: 필수 범위 확인하기. 예문과 단어가 같아야 하는 것은 아니다."
    },
    {
      "id": "step-3",
      "goal": "단계 납품 제안하기",
      "example": "I can deliver that one tomorrow and the internal analysis on Friday.",
      "hints": [
        "의도: 단계 납품 제안하기",
        "핵심 표현: deliver = 제공하다",
        "완성 문장 예시: I can deliver that one tomorrow and the internal analysis on Friday. — 의미가 같은 다른 표현도 가능합니다."
      ],
      "successCriterion": "상대가 이해할 수 있게 다음 행동을 수행한다: 단계 납품 제안하기. 예문과 단어가 같아야 하는 것은 아니다."
    }
  ],
  "pedagogy": {
    "researchIds": [
      "CEFR-2020",
      "TBLT-2019",
      "TBLT-CRITIQUE",
      "SPACING-2022",
      "RETRIEVAL-2008",
      "FEEDBACK-2010",
      "FOUR-STRANDS-2007"
    ],
    "supportFade": "장단점·반론·이해관계 확인; 예시는 요청 시 제공. 먼저 상황과 첫 발화의 뜻을 확인하고 변경 영향 설명하기에 필요한 표현을 살핀다. 의도→핵심 표현→완성 문장 순으로 필요한 도움만 제공한다. 두 번째 시도는 완성 문장을 가리고, 세 번째는 힌트를 가린다. 막히면 도움을 다시 제공하고 도움받은 수행과 독립 수행을 구분한다.",
    "retrieval": "예문을 가린 뒤 '요청 증가에 범위와 기한 조율하기' 상황에서 변경 영향 설명하기 / 필수 범위 확인하기 / 단계 납품 제안하기 기억한 문장을 그대로 외우기보다 상대의 질문에 맞춰 자신의 말로 응답한다.",
    "transfer": "다음에는 두 분석 모두 필수라 다른 업무 중단 또는 지원을 협의한다.",
    "review": {
      "intervalDays": [
        1,
        3,
        7,
        21
      ],
      "prompt": "복습 간격은 초기 운영 가설이며 성공과 어려움에 따라 조정한다. '요청 증가에 범위와 기한 조율하기'을 무힌트로 다시 수행한다. 이어서 조건을 바꾼다: 다음에는 두 분석 모두 필수라 다른 업무 중단 또는 지원을 협의한다. 결과와 도움 사용을 따로 기록한다."
    }
  },
  "assessment": {
    "criteria": [
      "변경 영향 설명하기 / 필수 범위 확인하기 / 단계 납품 제안하기",
      "변경 영향 설명하기",
      "필수 범위 확인하기",
      "단계 납품 제안하기",
      "수준별 관찰: 대안 비교와 근거 있는 조율. 문법 오류 수나 희귀 단어만으로 판정하지 않는다."
    ],
    "acceptParaphrases": true,
    "feedbackPolicy": "먼저 전달된 의미와 달성한 과업을 짚는다. 의미 전달을 막는 오류 한두 개에 짧은 한국어 설명과 재표현 기회를 제공한다. 초보가 막히면 예시를 보여준 뒤 다시 시도하게 한다. 도움받은 완료를 독립 숙달로 판정하지 않고 조건 변경 및 지연 수행을 별도로 확인한다. 텍스트만으로 발음·청취 성공을 판정하지 않는다."
  }
}
