{
  "$schema": "../../../mission.schema.json",
  "schemaVersion": 1,
  "key": "social-invitations-c1-clarify-optional-obligation",
  "title": "선택이라지만 압박이 있는 초대 확인하기",
  "categoryId": "social",
  "subcategoryId": "invitations",
  "difficulty": "C1",
  "scenario": "모임의 친목 여행은 선택이라고 하지만 불참자는 팀워크가 약하다는 말이 나옵니다.",
  "practicalOutcome": "초대의 숨은 의무를 드러내고 실제 선택권을 합의한다.",
  "roles": {
    "learner": "상황 속 대화 참여자(가상 정보 사용)",
    "interlocutor": "주최자. 참여율을 높이고 싶지만 비용과 개인 사정을 공개시키려는 의도는 없다고 말한다."
  },
  "opening": "It's entirely optional, although committed members usually come.",
  "estimatedMinutes": 18,
  "prerequisites": [],
  "steps": [
    {
      "id": "step-1",
      "goal": "표면적 선택과 암묵적 기대 구분하기",
      "example": "Calling it optional while linking attendance to commitment sends two different messages.",
      "hints": [
        "의도: 표면적 선택과 암묵적 기대 구분하기",
        "핵심 표현: commitment = 참여 의지",
        "완성 문장 예시: Calling it optional while linking attendance to commitment sends two different messages. — 의미가 같은 다른 표현도 가능합니다."
      ],
      "successCriterion": "상대가 이해할 수 있게 다음 행동을 수행한다: 표면적 선택과 암묵적 기대 구분하기. 예문과 단어가 같아야 하는 것은 아니다."
    },
    {
      "id": "step-2",
      "goal": "사생활 없는 선택권 요청하기",
      "example": "Could we make clear that declining doesn't require a personal explanation or affect someone's standing?",
      "hints": [
        "의도: 사생활 없는 선택권 요청하기",
        "핵심 표현: standing = 집단 내 평가",
        "완성 문장 예시: Could we make clear that declining doesn't require a personal explanation or affect someone's standing? — 의미가 같은 다른 표현도 가능합니다."
      ],
      "successCriterion": "상대가 이해할 수 있게 다음 행동을 수행한다: 사생활 없는 선택권 요청하기. 예문과 단어가 같아야 하는 것은 아니다."
    },
    {
      "id": "step-3",
      "goal": "동등한 참여 기회 제안하기",
      "example": "A local, low-cost gathering later would also let people stay connected.",
      "hints": [
        "의도: 동등한 참여 기회 제안하기",
        "핵심 표현: stay connected = 관계를 유지하다",
        "완성 문장 예시: A local, low-cost gathering later would also let people stay connected. — 의미가 같은 다른 표현도 가능합니다."
      ],
      "successCriterion": "상대가 이해할 수 있게 다음 행동을 수행한다: 동등한 참여 기회 제안하기. 예문과 단어가 같아야 하는 것은 아니다."
    }
  ],
  "pedagogy": {
    "researchIds": [
      "CEFR-2020",
      "TBLT-2019",
      "TBLT-CRITIQUE",
      "SPACING-2022",
      "RETRIEVAL-2008",
      "FEEDBACK-2010",
      "FOUR-STRANDS-2007"
    ],
    "supportFade": "요청 시만 지원; 전제와 불확실성 구분. 먼저 상황과 첫 발화의 뜻을 확인하고 표면적 선택과 암묵적 기대 구분하기에 필요한 표현을 살핀다. 의도→핵심 표현→완성 문장 순으로 필요한 도움만 제공한다. 두 번째 시도는 완성 문장을 가리고, 세 번째는 힌트를 가린다. 막히면 도움을 다시 제공하고 도움받은 수행과 독립 수행을 구분한다.",
    "retrieval": "예문을 가린 뒤 '선택이라지만 압박이 있는 초대 확인하기' 상황에서 초대의 숨은 의무를 드러내고 실제 선택권을 합의한다. 기억한 문장을 그대로 외우기보다 상대의 질문에 맞춰 자신의 말로 응답한다.",
    "transfer": "주최자가 필수 운영 회의도 포함한다고 한다. 업무 일정과 친목 활동을 분리해 안내한다.",
    "review": {
      "intervalDays": [
        1,
        3,
        7,
        21
      ],
      "prompt": "복습 간격은 초기 운영 가설이며 성공과 어려움에 따라 조정한다. '선택이라지만 압박이 있는 초대 확인하기'을 무힌트로 다시 수행한다. 이어서 조건을 바꾼다: 주최자가 필수 운영 회의도 포함한다고 한다. 업무 일정과 친목 활동을 분리해 안내한다. 결과와 도움 사용을 따로 기록한다."
    }
  },
  "assessment": {
    "criteria": [
      "초대의 숨은 의무를 드러내고 실제 선택권을 합의한다.",
      "표면적 선택과 암묵적 기대 구분하기",
      "사생활 없는 선택권 요청하기",
      "동등한 참여 기회 제안하기",
      "수준별 관찰: 어조 조절, 암시 이해, 복합 정보 중재. 문법 오류 수나 희귀 단어만으로 판정하지 않는다."
    ],
    "acceptParaphrases": true,
    "feedbackPolicy": "먼저 전달된 의미와 달성한 과업을 짚는다. 의미 전달을 막는 오류 한두 개에 짧은 한국어 설명과 재표현 기회를 제공한다. 초보가 막히면 예시를 보여준 뒤 다시 시도하게 한다. 도움받은 완료를 독립 숙달로 판정하지 않고 조건 변경 및 지연 수행을 별도로 확인한다. 텍스트만으로 발음·청취 성공을 판정하지 않는다."
  }
}
